{
  "contract_version": "1.0.0",
  "task_id": "22222222-2222-4222-8222-222222222222",
  "run_id": "11111111-1111-4111-8111-111111111111",
  "role": "fake",
  "issued_at": "2026-08-22T16:00:02Z",
  "expires_at": "2026-08-22T16:05:02Z",
  "scopes": ["context:read", "output:write", "heartbeat:write"],
  "context_manifest": [
    {
      "source_id": "briefing-001",
      "source_type": "briefing",
      "hash": "sha256:aaaaaaaaaaaaaaaaaaaaaaaaaaaaaaaaaaaaaaaaaaaaaaaaaaaaaaaaaaaaaaaa"
    }
  ],
  "input": {
    "echo": "first-distributed-slice"
  }
}
